<?xml version="1.0" encoding="UTF-8"?>

<universal-node xmlns:xsi="http://www.w3.org/2001/XMLSchema-instance" 
                 xsi:noNamespaceSchemaLocation="universal-node-schema.xsd">

	<resources>
		<cpu amount="10"/>
		<memory amount="32" unit="GB"/>
		<storage amount="5" unit="TB"/>
		
		<!--
			Values for "unit":
			* MB
			* GB
			* TB
		-->
		
	</resources>	

	<ports>
		<port name="10ge0" type="ethernet" side="edge">
			<virtualized as="OVS-north external port" port-type="port-sap"/>
		</port>
		<port name="10ge1" type="ethernet" side="core">
			<virtualized as="OVS-south external port" port-type="port-sap"/>
		</port>
		
		<!-- 
			Values for "type":
			* ethernet
			* wifi
			
			Note that not all the vSwitches supports DPDK ports.
		
			Values for "side":
			* edge
			* core
			* none
			
			Values for "port-type":
			* port-abstract
			* port-type
		-->	
		
	</ports>	

</universal-node>
